{
  "$schema": "https://json-schema.org/draft/2020-12/schema",
  "$id": "https://opensecurityarchitecture.org/schema/attack-metadata.schema.json",
  "title": "OSA TRIDENT Graph Metadata",
  "description": "Provenance, version info, and graph summary for the TRIDENT threat model data",
  "type": "object",
  "required": [
    "description",
    "graph_version",
    "graph_schema_version",
    "graph_build_id",
    "data_layers",
    "graph_summary",
    "files",
    "attack_domain",
    "last_updated"
  ],
  "additionalProperties": false,

  "properties": {
    "description": {
      "type": "string",
      "minLength": 1,
      "description": "Human-readable description of this dataset"
    },
    "graph_version": {
      "type": "string",
      "pattern": "^\\d+\\.\\d+\\.\\d+$",
      "description": "Semantic version for the graph data (major.minor.patch)"
    },
    "graph_schema_version": {
      "type": "string",
      "pattern": "^\\d+\\.\\d+$",
      "description": "Must match trident-model.json version. Website build fails on mismatch."
    },
    "graph_build_id": {
      "type": "string",
      "description": "ISO timestamp of last graph build"
    },
    "changelog": {
      "type": "array",
      "items": {
        "type": "object",
        "required": ["version", "date", "type", "changes"],
        "additionalProperties": false,
        "properties": {
          "version": { "type": "string" },
          "date": { "type": "string", "format": "date" },
          "type": { "type": "string", "enum": ["major", "minor", "patch"] },
          "changes": {
            "type": "array",
            "items": {
              "type": "object",
              "required": ["category", "action", "description"],
              "additionalProperties": false,
              "properties": {
                "category": { "type": "string" },
                "action": { "type": "string", "enum": ["add", "modify", "remove"] },
                "description": { "type": "string" }
              }
            }
          }
        }
      },
      "description": "Version history of graph changes"
    },
    "data_layers": {
      "type": "object",
      "minProperties": 1,
      "additionalProperties": {
        "type": "object",
        "properties": {
          "source": { "type": "string" },
          "source_url": { "type": "string", "format": "uri" },
          "attack_version": { "type": "string" },
          "nist_version": { "type": "string" },
          "cis_version": { "type": "string" },
          "capec_version": { "type": "string" },
          "total_mappings": { "type": "integer", "minimum": 0 },
          "controls_mapped": { "type": "integer", "minimum": 0 },
          "techniques_mapped": { "type": "integer", "minimum": 0 },
          "total_mitigations": { "type": "integer", "minimum": 0 },
          "mitigation_technique_edges": { "type": "integer", "minimum": 0 },
          "mitigations_with_control_links": { "type": "integer", "minimum": 0 },
          "total_detection_strategies": { "type": "integer", "minimum": 0 },
          "detection_technique_edges": { "type": "integer", "minimum": 0 },
          "total_safeguards": { "type": "integer", "minimum": 0 },
          "implemented_by_edges": { "type": "integer", "minimum": 0 },
          "total_cwe_entries": { "type": "integer", "minimum": 0 },
          "cwe_technique_edges": { "type": "integer", "minimum": 0 },
          "techniques_with_cwe": { "type": "integer", "minimum": 0 },
          "families_covered": {
            "type": "array",
            "items": { "type": "string", "pattern": "^[A-Z]{2}$" }
          },
          "enrichment_date": { "type": "string", "format": "date" },
          "notes": { "type": "string" }
        },
        "description": "Provenance for one data layer in the TRIDENT model"
      },
      "description": "Data layer provenance (technique_control_mappings, mitigations, detection_strategies, etc.)"
    },
    "graph_summary": {
      "type": "object",
      "required": ["total_edges", "edge_types", "node_types"],
      "additionalProperties": true,
      "properties": {
        "total_edges": { "type": "integer", "minimum": 0 },
        "edge_types": {
          "type": "object",
          "additionalProperties": { "type": "integer", "minimum": 0 }
        },
        "node_types": {
          "type": "object",
          "additionalProperties": { "type": "integer", "minimum": 0 }
        },
        "trident_paths": {
          "type": "object",
          "additionalProperties": { "type": "string" }
        }
      },
      "description": "Aggregate graph statistics"
    },
    "files": {
      "type": "object",
      "minProperties": 1,
      "additionalProperties": {
        "type": "object",
        "required": ["description", "sha256"],
        "additionalProperties": false,
        "properties": {
          "description": { "type": "string" },
          "sha256": { "type": "string", "pattern": "^[a-f0-9]{64}$" },
          "entity_count": { "type": "integer", "minimum": 0 },
          "last_modified": { "type": "string" }
        }
      },
      "description": "Data files with integrity checksums and metadata"
    },
    "jurisdiction_index": {
      "type": "object",
      "description": "Lookup index for framework jurisdiction applicability, keyed by framework_id",
      "additionalProperties": true
    },
    "attack_domain": {
      "type": "string",
      "enum": ["enterprise", "mobile", "ics"],
      "description": "ATT&CK domain"
    },
    "last_updated": {
      "type": "string",
      "format": "date",
      "description": "Date of last update to this metadata"
    }
  }
}
