{
  "description": "TRIDENT attack/weakness/control graph data for Open Security Architecture",
  "graph_version": "2.1.1",
  "graph_schema_version": "1.1",
  "graph_build_id": "2026-02-22T17:40:00Z",
  "changelog": [
    {
      "version": "2.1.1",
      "date": "2026-02-22",
      "type": "patch",
      "changes": [
        {
          "category": "model",
          "action": "add",
          "description": "Declare infrastructure_behavioral_profile node type and PROFILE_DESCRIBES, DEFAULT_WEAKNESS, DEFAULT_USES_PROTOCOL edge types in metadata (counts pending full graph sync)"
        }
      ]
    },
    {
      "version": "2.1.0",
      "date": "2026-02-22",
      "type": "minor",
      "changes": [
        {
          "category": "model",
          "action": "add",
          "description": "explorerPlacement, graphKey, refFields, pseudoEdges added to trident-model.json (v1.1)"
        },
        {
          "category": "versioning",
          "action": "add",
          "description": "graph_version, graph_schema_version, graph_build_id added to metadata.json"
        }
      ]
    },
    {
      "version": "2.0.0",
      "date": "2026-02-21",
      "type": "major",
      "changes": [
        {
          "category": "entity",
          "action": "add",
          "description": "ATLAS v5.4.0 merged: 155 AML.T techniques, 35 AML.M mitigations"
        },
        {
          "category": "edge",
          "action": "add",
          "description": "RELATED_TO cross-framework mitigation equivalence edges"
        },
        {
          "category": "entity",
          "action": "add",
          "description": "Insurance platform types (TISP): 37 primitives, 10 categories"
        }
      ]
    },
    {
      "version": "1.0.0",
      "date": "2026-02-20",
      "type": "major",
      "changes": [
        {
          "category": "entity",
          "action": "add",
          "description": "Initial TRIDENT graph: 22 entity types, 38 edge types, 15K+ edges"
        }
      ]
    }
  ],
  "data_layers": {
    "technique_control_mappings": {
      "source": "CTID (Center for Threat-Informed Defense)",
      "source_url": "https://github.com/center-for-threat-informed-defense/mappings-explorer",
      "attack_version": "16.1",
      "nist_version": "NIST 800-53 Rev 5",
      "total_mappings": 5313,
      "controls_mapped": 109,
      "techniques_mapped": 469,
      "families_covered": [
        "AC",
        "CA",
        "CM",
        "CP",
        "IA",
        "MP",
        "RA",
        "SA",
        "SC",
        "SI",
        "SR"
      ],
      "enrichment_date": "2026-02-14",
      "status": "legacy",
      "deprecation": {
        "deprecated_date": "2026-02-16",
        "reason": "Superseded by TRIDENT mitigation path (Control -> Mitigation -> Technique) which uses MITRE first-party data. CTID is a third-party interpretive mapping with 99.5% overlap with the mitigation path but lower authority.",
        "superseded_by": "mitigations + graph-edges (COUNTERS, PRESCRIBES)",
        "retained_for": "backtesting, quality assurance, coverage validation against TRIDENT mitigation path",
        "removed_from": [
          "trident-explorer",
          "attack-matrix-detail-panel"
        ],
        "data_preserved": true
      },
      "notes": "CTID maps 11 NIST families. Controls in other families (AT, AU, IR, MA, PE, PL, PM, PS, PT) have no ATT&CK mappings in this dataset. LEGACY: retained for validation only \u2014 the TRIDENT mitigation path (Control -PRESCRIBES-> Mitigation -COUNTERS-> Technique) provides equivalent coverage using MITRE first-party data."
    },
    "mitigations": {
      "source": "MITRE ATT&CK STIX Data",
      "source_url": "https://github.com/mitre-attack/attack-stix-data",
      "attack_version": "18.1",
      "total_mitigations": 44,
      "mitigation_technique_edges": 1445,
      "mitigations_with_control_links": 43,
      "enrichment_date": "2026-02-14",
      "notes": "44 ATT&CK mitigations (M-series) with technique COUNTERS relationships. Cross-referenced to SP800-53 controls via shared technique coverage (PRESCRIBES edges). M1055 'Do Not Mitigate' correctly has no control links."
    },
    "detection_strategies": {
      "source": "MITRE ATT&CK STIX Data (v18 detection overhaul)",
      "source_url": "https://github.com/mitre-attack/attack-stix-data",
      "attack_version": "18.1",
      "total_detection_strategies": 691,
      "detection_technique_edges": 691,
      "enrichment_date": "2026-02-14",
      "notes": "ATT&CK v18 replaced Data Sources with Detection Strategies (DET-series). Each strategy maps to one technique via DETECTS relationship."
    },
    "cis_safeguard_index": {
      "source": "OSA control data (compliance_mappings.cis_controls_v8)",
      "cis_version": "CIS Controls v8",
      "total_safeguards": 171,
      "implemented_by_edges": 468,
      "enrichment_date": "2026-02-14",
      "notes": "Reverse index of CIS v8 safeguard -> SP800-53 controls from existing OSA compliance mappings. Provides the IMPLEMENTED_BY edges in the TRIDENT model."
    },
    "weakness_catalog": {
      "source": "MITRE CWE via CAPEC bridge",
      "capec_version": "3.9",
      "source_url": "https://capec.mitre.org/data/xml/capec_latest.xml",
      "total_cwe_entries": 135,
      "cwe_technique_edges": 1162,
      "techniques_with_cwe": 340,
      "enrichment_date": "2026-02-14",
      "notes": "CWE weakness classes mapped to ATT&CK techniques via CAPEC bridge + TRIDENT enrichment (parent inheritance, sub-technique roll-up, curated direct mappings). 135 CWEs map to 340 techniques through 1,162 EXPLOITS edges. 100% T1/T2 TACM tier coverage."
    },
    "threat_actors": {
      "source": "MITRE ATT&CK STIX Data",
      "source_url": "https://github.com/mitre-attack/attack-stix-data",
      "attack_version": "18.1",
      "total_actors": 163,
      "uses_technique_edges": 2921,
      "techniques_with_actors": 313,
      "enrichment_date": "2026-02-14",
      "notes": "163 active ATT&CK threat groups (G-series intrusion-sets) with USES relationships to techniques. 9 actors excluded (revoked/deprecated or no technique overlap with our 469-technique catalog). Actors carry aliases but not country attribution (deferred)."
    },
    "process_capability_catalog": {
      "source": "OSA TPCE (Trident Process Capability Enumeration)",
      "author": "Chris Lethaby (Vinylwasp)",
      "total_capabilities": 30,
      "families_covered": [
        "AC",
        "AT",
        "AU",
        "CA",
        "CM",
        "CP",
        "IA",
        "IR",
        "MA",
        "MP",
        "PE",
        "PL",
        "PM",
        "PS",
        "RA",
        "SA",
        "SC",
        "SI",
        "SR"
      ],
      "classified_by_edges": 99,
      "enrichment_date": "2026-02-16",
      "notes": "30 process capability classes across 19 NIST 800-53 families. Each capability mapped to SP800-53 controls, CIS Safeguards, and ATT&CK Mitigations. Provides CLASSIFIED_BY edges connecting process implementations to canonical capability identifiers."
    },
    "technology_capability_catalog": {
      "source": "OSA TTCE (Trident Technology Capability Enumeration)",
      "author": "Chris Lethaby (Vinylwasp)",
      "d3fend_alignment": true,
      "total_classes": 28,
      "total_capabilities": 86,
      "categories": 9,
      "provides_capability_edges": 99,
      "enrichment_date": "2026-02-16",
      "notes": "28 technology capability classes across 9 categories with 86 individual capabilities built on MITRE D3FEND. Each class mapped to SP800-53 controls, CIS Safeguards, and ATT&CK Mitigations. Provides PROVIDES_CAPABILITY edges connecting technology implementations to capability profiles."
    },
    "adversary_capability_model": {
      "source": "OSA TACM (Trident Adversary Capability Model)",
      "author": "Chris Lethaby (Vinylwasp)",
      "design_doc": "trident-adversary-capability-model.md",
      "total_tiers": 5,
      "techniques_tiered": 469,
      "tier_distribution": {
        "T1_opportunistic": 99,
        "T2_targeted_criminal": 202,
        "T3_organised_state_proxy": 147,
        "T4_state_directed": 20,
        "T5_strategic": 1
      },
      "tier_contains_edges": 469,
      "stix_alignment": true,
      "nist_830_alignment": true,
      "enrichment_date": "2026-02-16",
      "notes": "5 adversary capability tiers (T1-T5) classifying all 469 ATT&CK techniques by minimum adversary sophistication required. Tiers are cumulative \u2014 higher tiers include all lower tier tradecraft. Uses STIX 2.1 vocabularies for actor attributes and NIST SP 800-30 capability/intent/targeting model. Technique assignments based on tool availability, skill requirement, detection difficulty, operational complexity, and prerequisite access."
    },
    "human_factors_model": {
      "source": "OSA THFM (Trident Human Factors Model)",
      "author": "Chris Lethaby (Vinylwasp)",
      "design_doc": "trident-human-factors-model.md",
      "total_classes": 24,
      "categories": 6,
      "category_breakdown": {
        "AU_authority_compliance": 3,
        "UR_urgency_scarcity": 3,
        "TR_trust_rapport": 4,
        "CU_curiosity_reward": 3,
        "HB_habitual_cognitive_load": 4,
        "IN_insider_disposition": 7
      },
      "cialdini_mapped": 17,
      "insider_classes": 7,
      "exploits_human_edges": 31,
      "enrichment_date": "2026-02-16",
      "notes": "24 cognitive vulnerability classes across 6 categories. Social engineering classes (AU/UR/TR/CU/HB) map to ATT&CK techniques via EXPLOITS_HUMAN edges with rationale. Insider disposition classes (IN) have no technique edges \u2014 they are risk factors mitigated by SP800-53 controls. Cialdini principle mapping on 17 of 24 classes; remaining 7 map to cognitive biases outside Cialdini framework."
    },
    "data_classification_catalog": {
      "source": "OSA TDCE (Trident Data Classification Enumeration)",